State/City,Population,Median_Household_Income,Key_Industries,Bitcoin_Adoption_Statistics,State_Digital_Asset_Laws,State_Trust_Laws,State_Probate_Laws,State_Case_Law
New York,"19,336,776","$72,108","Finance, Technology, Real Estate",High adoption with 15% of residents owning cryptocurrency,Comprehensive BitLicense framework,Favorable dynasty trust laws,Streamlined probate process,Strong digital asset precedents
California,"39,237,836","$84,097","Technology, Entertainment, Agriculture",Leading adoption with 20% cryptocurrency ownership,Progressive digital asset regulations,Comprehensive trust statutes,Efficient probate procedures,Extensive digital asset case law
Texas,"30,029,572","$67,321","Energy, Technology, Agriculture",Growing adoption with 12% ownership rate,Business-friendly crypto regulations,Strong asset protection laws,Independent administration available,Developing digital asset precedents
Florida,"22,244,823","$59,227","Tourism, Agriculture, Aerospace",High retiree adoption with 10% ownership,Crypto-friendly regulatory environment,No state income tax benefits,Simplified probate options,Growing digital asset jurisprudence
South Dakota,"886,667","$59,533","Agriculture, Tourism, Finance",Moderate adoption with 8% ownership,Minimal crypto regulations,Premier trust jurisdiction,Trust-friendly probate laws,Trust-focused legal precedents
Los Angeles,"3,898,747","$69,778","Entertainment, Technology, International Trade",High tech adoption with 18% ownership,California state regulations apply,California trust laws,California probate procedures,LA County digital asset cases
Chicago,"2,746,388","$58,247","Finance, Manufacturing, Technology",Financial sector adoption with 14% ownership,Illinois state regulations,Illinois trust statutes,Illinois probate laws,Cook County precedents
Houston,"2,304,580","$52,338","Energy, Aerospace, International Trade",Energy sector adoption with 11% ownership,Texas state regulations,Texas trust laws,Texas probate procedures,Harris County cases
Miami,"467,963","$44,268","Finance, International Trade, Tourism",International adoption with 16% ownership,Florida state regulations,Florida trust laws,Florida probate procedures,Miami-Dade precedents
Seattle,"753,675","$102,486","Technology, Aerospace, Maritime",Tech sector adoption with 22% ownership,Washington state regulations,Washington trust statutes,Washington probate laws,King County digital asset cases
